[{"data": "2018-12-21", "tipo": "video", "voz": "propria", "titulo": "Precisamos destruir o STF! | por Renan Santos", "fonte": "channel/UC8QAdpiEWAOg3AOCCFDCOYw", "url": "https://www.youtube.com/watch?v=Vy6ADI-utRQ", "duracao_s": 464, "origem": "retro", "candidato": "renan-santos"}, {"data": "2018-12-05", "tipo": "video", "voz": "propria", "titulo": "#STFPRENDEAGENTE | por Pedro Deyrot e Rubinho Nunes", "fonte": "channel/UC8QAdpiEWAOg3AOCCFDCOYw", "url": "https://www.youtube.com/watch?v=MVNBHxrw918", "duracao_s": 474, "origem": "retro", "candidato": "renan-santos"}, {"data": "2018-11-28", "tipo": "video", "voz": "propria", "titulo": "MBL pedirá Impeachment de Luiz Fux! | por Rubinho Nunes", "fonte": "channel/UC8QAdpiEWAOg3AOCCFDCOYw", "url": "https://www.youtube.com/watch?v=UQmxUBkiLoA", "duracao_s": 222, "origem": "retro", "candidato": "renan-santos"}, {"data": "2018-11-21", "tipo": "video", "voz": "propria", "titulo": "O segredo por trás do aumento do judiciário | por Kim Kataguiri", "fonte": "channel/UC8QAdpiEWAOg3AOCCFDCOYw", "url": "https://www.youtube.com/watch?v=ZQoSYBL3hWM", "duracao_s": 372, "origem": "retro", "candidato": "renan-santos"}, {"data": "2018-11-08", "tipo": "video", "voz": "propria", "titulo": "AUMENTO DO STF: Explicando o golpe! | por Pedro Deyrot", "fonte": "channel/UC8QAdpiEWAOg3AOCCFDCOYw", "url": "https://www.youtube.com/watch?v=JA40ggrXC8Q", "duracao_s": 399, "origem": "retro", "candidato": "renan-santos"}, {"data": "2018-11-07", "tipo": "video", "voz": "propria", "titulo": "STF: Lula contra Sérgio Moro e STF! | por Rubinho Nunes", "fonte": "channel/UC8QAdpiEWAOg3AOCCFDCOYw", "url": "https://www.youtube.com/watch?v=u06kjWqbUwI", "duracao_s": 486, "origem": "retro", "candidato": "renan-santos"}, {"data": "2018-11-04", "tipo": "video", "voz": "propria", "titulo": "Desarmamento: entenda o golpe contra o PL3722 | por Kim Kataguiri", "fonte": "channel/UC8QAdpiEWAOg3AOCCFDCOYw", "url": "https://www.youtube.com/watch?v=enzgIHS7R1U", "duracao_s": 208, "origem": "retro", "candidato": "renan-santos"}, {"data": "2018-10-23", "tipo": "video", "voz": "propria", "titulo": "Bolsonaros querem fechar o STF? | por Pedro D'eyrot", "fonte": "channel/UC8QAdpiEWAOg3AOCCFDCOYw", "url": "https://www.youtube.com/watch?v=a7UfiFCKRig", "duracao_s": 407, "origem": "retro", "candidato": "renan-santos"}, {"data": "2018-09-30", "tipo": "video", "voz": "propria", "titulo": "Golpe de Estado: O plano de Haddad.| por Kim Kataguiri", "fonte": "channel/UC8QAdpiEWAOg3AOCCFDCOYw", "url": "https://www.youtube.com/watch?v=l9eET3UFBp0", "duracao_s": 1775, "origem": "retro", "candidato": "renan-santos"}, {"data": "2018-08-10", "tipo": "video", "voz": "propria", "titulo": "ABORTO LEGALIZADO NO STF: ISSO, SIM, É GOLPE", "fonte": "channel/UC8QAdpiEWAOg3AOCCFDCOYw", "url": "https://www.youtube.com/watch?v=QQljuIYsrEo", "duracao_s": 377, "origem": "retro", "candidato": "renan-santos"}, {"data": "2018-06-29", "tipo": "video", "voz": "propria", "titulo": "Kim Kataguiri | Como acabar com a PATIFARIA do STF no Brasil?", "fonte": "channel/UC8QAdpiEWAOg3AOCCFDCOYw", "url": "https://www.youtube.com/watch?v=bORybZZeEQM", "duracao_s": 150, "origem": "retro", "candidato": "renan-santos"}, {"data": "2018-05-17", "tipo": "video", "voz": "propria", "titulo": "Kim Kataguiri: Precisamos olhar para os privilégios do judiciário!", "fonte": "channel/UC8QAdpiEWAOg3AOCCFDCOYw", "url": "https://www.youtube.com/watch?v=9gCq15R011E", "duracao_s": 131, "origem": "retro", "candidato": "renan-santos"}, {"data": "2018-05-15", "tipo": "video", "voz": "propria", "titulo": "A ditadura do POLITICAMENTE CORRETO chega a seu ápice!", "fonte": "channel/UC8QAdpiEWAOg3AOCCFDCOYw", "url": "https://www.youtube.com/watch?v=Ee6sr_d45Pw", "duracao_s": 145, "origem": "retro", "candidato": "renan-santos"}, {"data": "2018-05-02", "tipo": "video", "voz": "propria", "titulo": "Deputado petista tenta \"censurar\" STF/STJ - Assista!", "fonte": "channel/UC8QAdpiEWAOg3AOCCFDCOYw", "url": "https://www.youtube.com/watch?v=7fKh0Zrfe8c", "duracao_s": 140, "origem": "retro", "candidato": "renan-santos"}, {"data": "2018-02-28", "tipo": "video", "voz": "propria", "titulo": "342 INTERVENÇÃO - A nova farsa do Projaquistão", "fonte": "channel/UC8QAdpiEWAOg3AOCCFDCOYw", "url": "https://www.youtube.com/watch?v=7_VOoI9AWBk", "duracao_s": 196, "origem": "retro", "candidato": "renan-santos"}, {"data": "2018-02-16", "tipo": "video", "voz": "propria", "titulo": "Intervenção Federal no Rio de Janeiro", "fonte": "channel/UC8QAdpiEWAOg3AOCCFDCOYw", "url": "https://www.youtube.com/watch?v=USQI-j10QD0", "duracao_s": 607, "origem": "retro", "candidato": "renan-santos"}, {"data": "2018-01-16", "tipo": "video", "voz": "propria", "titulo": "Ditadura de Maduro assassina Oscar Pérez", "fonte": "channel/UC8QAdpiEWAOg3AOCCFDCOYw", "url": "https://www.youtube.com/watch?v=-AOtyC4zUNw", "duracao_s": 151, "origem": "retro", "candidato": "renan-santos"}]