[{"data": "2016-11-23", "tipo": "video", "voz": "propria", "titulo": "IMPEACHMENT DO GOVERNADOR PEZÃO", "fonte": "channel/UCl2HptoHv6PjZMQAwTdA--Q", "url": "https://www.youtube.com/watch?v=oSR3TZ5thU0", "duracao_s": 96, "origem": "retro", "candidato": "flavio-bolsonaro"}, {"data": "2016-03-12", "tipo": "video", "voz": "propria", "titulo": "BOLSONARO FALA EM IMPEACHMENT DE GOVERNADOR PEZÃO", "fonte": "channel/UCl2HptoHv6PjZMQAwTdA--Q", "url": "https://www.youtube.com/watch?v=qxWMYimP1GY", "duracao_s": 465, "origem": "retro", "candidato": "flavio-bolsonaro"}]