[{"data": "2017-09-29", "tipo": "video", "voz": "propria", "titulo": "Fomos até a Rocinha ver a real sobre as forças armadas.", "fonte": "channel/UC8QAdpiEWAOg3AOCCFDCOYw", "url": "https://www.youtube.com/watch?v=6ooRR5iI7T4", "duracao_s": 408, "origem": "retro", "candidato": "renan-santos"}, {"data": "2017-09-06", "tipo": "video", "voz": "propria", "titulo": "Ministro do STF diz que divulgar supersalários enfraquece o judiciário", "fonte": "channel/UC8QAdpiEWAOg3AOCCFDCOYw", "url": "https://www.youtube.com/watch?v=Ta4J3P7NQPM", "duracao_s": 137, "origem": "retro", "candidato": "renan-santos"}, {"data": "2017-08-31", "tipo": "video", "voz": "propria", "titulo": "UM ANO DE GOLPE", "fonte": "channel/UC8QAdpiEWAOg3AOCCFDCOYw", "url": "https://www.youtube.com/watch?v=7sjWuBy8m3k", "duracao_s": 134, "origem": "retro", "candidato": "renan-santos"}, {"data": "2017-08-01", "tipo": "video", "voz": "propria", "titulo": "Impeachment salvou o Brasil de virar uma Venezuela", "fonte": "channel/UC8QAdpiEWAOg3AOCCFDCOYw", "url": "https://www.youtube.com/watch?v=3jUEIi5Hp0w", "duracao_s": 107, "origem": "retro", "candidato": "renan-santos"}, {"data": "2017-06-05", "tipo": "video", "voz": "propria", "titulo": "Judiciário brasileiro: Caro, ineficiente e injusto.", "fonte": "channel/UC8QAdpiEWAOg3AOCCFDCOYw", "url": "https://www.youtube.com/watch?v=ZvIwK0hvUpI", "duracao_s": 194, "origem": "retro", "candidato": "renan-santos"}, {"data": "2017-04-24", "tipo": "video", "voz": "propria", "titulo": "PT e PSOL continuam apoiando a ditadura sanguinária de Maduro", "fonte": "channel/UC8QAdpiEWAOg3AOCCFDCOYw", "url": "https://www.youtube.com/watch?v=M6SLpliR77s", "duracao_s": 153, "origem": "retro", "candidato": "renan-santos"}, {"data": "2017-04-21", "tipo": "video", "voz": "propria", "titulo": "Deputados do PT e do PSOL defendem ditadura de Maduro", "fonte": "channel/UC8QAdpiEWAOg3AOCCFDCOYw", "url": "https://www.youtube.com/watch?v=13ZYIVMnmVU", "duracao_s": 126, "origem": "retro", "candidato": "renan-santos"}, {"data": "2017-02-17", "tipo": "video", "voz": "propria", "titulo": "Dr. Pavinatto dá uma aula sobre Foro Privilegiado e Judiciário brasileiro.", "fonte": "channel/UC8QAdpiEWAOg3AOCCFDCOYw", "url": "https://www.youtube.com/watch?v=vPLN33VBB-g", "duracao_s": 2430, "origem": "retro", "candidato": "renan-santos"}, {"data": "2017-01-17", "tipo": "video", "voz": "propria", "titulo": "Jornal do Golpe", "fonte": "channel/UC8QAdpiEWAOg3AOCCFDCOYw", "url": "https://www.youtube.com/watch?v=hHUCc03fcDo", "duracao_s": 169, "origem": "retro", "candidato": "renan-santos"}]