[{"data": "2019-12-16", "tipo": "video", "voz": "propria", "titulo": "KIM KATAGUIRI: O STF QUER TE BOTAR NA CADEIA!", "fonte": "channel/UC8QAdpiEWAOg3AOCCFDCOYw", "url": "https://www.youtube.com/watch?v=uQJDFStgc_c", "duracao_s": 406, "origem": "retro", "candidato": "renan-santos"}, {"data": "2019-11-08", "tipo": "video", "voz": "propria", "titulo": "STF, Glenn e Augusto Nunes!", "fonte": "channel/UC8QAdpiEWAOg3AOCCFDCOYw", "url": "https://www.youtube.com/watch?v=4nbpwHwDJ7A", "duracao_s": 260, "origem": "retro", "candidato": "renan-santos"}, {"data": "2019-11-07", "tipo": "video", "voz": "propria", "titulo": "STF: SUPREMA TRAIÇÃO!", "fonte": "channel/UC8QAdpiEWAOg3AOCCFDCOYw", "url": "https://www.youtube.com/watch?v=6vsS7m-_zoA", "duracao_s": 478, "origem": "retro", "candidato": "renan-santos"}, {"data": "2019-09-07", "tipo": "video", "voz": "propria", "titulo": "O Filme Que Não Querem Que Você Veja. | Não Vai Ter Golpe!", "fonte": "channel/UC8QAdpiEWAOg3AOCCFDCOYw", "url": "https://www.youtube.com/watch?v=l094cOv02Ek", "duracao_s": 66, "origem": "retro", "candidato": "renan-santos"}, {"data": "2019-08-16", "tipo": "video", "voz": "propria", "titulo": "Trailer Não Vai Ter Golpe!", "fonte": "channel/UC8QAdpiEWAOg3AOCCFDCOYw", "url": "https://www.youtube.com/watch?v=77znC01Ed2M", "duracao_s": 151, "origem": "retro", "candidato": "renan-santos"}, {"data": "2019-08-15", "tipo": "video", "voz": "propria", "titulo": "O golpe do abuso de autoridade #VetaBolsonaro", "fonte": "channel/UC8QAdpiEWAOg3AOCCFDCOYw", "url": "https://www.youtube.com/watch?v=VUItbZ04hYk", "duracao_s": 604, "origem": "retro", "candidato": "renan-santos"}, {"data": "2019-08-11", "tipo": "video", "voz": "propria", "titulo": "Art. 142 - INTERVENÇÃO MILITAR JÁ! #FicheiroMBL", "fonte": "channel/UC8QAdpiEWAOg3AOCCFDCOYw", "url": "https://www.youtube.com/watch?v=S0IM0-9WvtA", "duracao_s": 692, "origem": "retro", "candidato": "renan-santos"}, {"data": "2019-08-01", "tipo": "video", "voz": "propria", "titulo": "Em memória de Hélio Bicudo | Teaser Não Vai Ter Golpe!", "fonte": "channel/UC8QAdpiEWAOg3AOCCFDCOYw", "url": "https://www.youtube.com/watch?v=tOtsjYjOe3k", "duracao_s": 88, "origem": "retro", "candidato": "renan-santos"}, {"data": "2019-07-31", "tipo": "video", "voz": "propria", "titulo": "IMPEACHMENT DE BOLSONARO! Vai rolar? - Análises Renais", "fonte": "channel/UC8QAdpiEWAOg3AOCCFDCOYw", "url": "https://www.youtube.com/watch?v=iFijjVuMdDU", "duracao_s": 384, "origem": "retro", "candidato": "renan-santos"}, {"data": "2019-07-31", "tipo": "video", "voz": "propria", "titulo": "OAB, BOLSONARO E DITADURA!", "fonte": "channel/UC8QAdpiEWAOg3AOCCFDCOYw", "url": "https://www.youtube.com/watch?v=LwJyRSRp_SQ", "duracao_s": 481, "origem": "retro", "candidato": "renan-santos"}, {"data": "2019-07-23", "tipo": "video", "voz": "propria", "titulo": "ATENÇÃO: O novo golpe da velha politica", "fonte": "channel/UC8QAdpiEWAOg3AOCCFDCOYw", "url": "https://www.youtube.com/watch?v=1ZqEF5Oi5YY", "duracao_s": 598, "origem": "retro", "candidato": "renan-santos"}, {"data": "2019-07-20", "tipo": "video", "voz": "propria", "titulo": "GOLPE ?!?1 | POR KIM KATAGUIRI", "fonte": "channel/UC8QAdpiEWAOg3AOCCFDCOYw", "url": "https://www.youtube.com/watch?v=I_LncdM6Xwg", "duracao_s": 131, "origem": "retro", "candidato": "renan-santos"}, {"data": "2019-07-13", "tipo": "video", "voz": "propria", "titulo": "O BRASIL MUDOU | Entenda como tudo começou | Teaser Não Vai Ter Golpe!", "fonte": "channel/UC8QAdpiEWAOg3AOCCFDCOYw", "url": "https://www.youtube.com/watch?v=9g24xKdUC8s", "duracao_s": 51, "origem": "retro", "candidato": "renan-santos"}, {"data": "2019-06-14", "tipo": "video", "voz": "propria", "titulo": "E lá vem o STF legislando mais uma vez... | Rubinho Nunes", "fonte": "channel/UC8QAdpiEWAOg3AOCCFDCOYw", "url": "https://www.youtube.com/watch?v=DIg7zb-ufHk", "duracao_s": 431, "origem": "retro", "candidato": "renan-santos"}, {"data": "2019-06-13", "tipo": "video", "voz": "propria", "titulo": "ESTÃO QUERENDO MUDAR A HISTÓRIA DO IMPEACHMENT - Não Vai Ter Golpe - Trailer Oficial 2", "fonte": "channel/UC8QAdpiEWAOg3AOCCFDCOYw", "url": "https://www.youtube.com/watch?v=ba31g8UbCqw", "duracao_s": 65, "origem": "retro", "candidato": "renan-santos"}, {"data": "2019-06-05", "tipo": "video", "voz": "propria", "titulo": "A regra de ouro e o impeachment de Bolsonaro | Renan Santos", "fonte": "channel/UC8QAdpiEWAOg3AOCCFDCOYw", "url": "https://www.youtube.com/watch?v=xB255ejzL8Q", "duracao_s": 643, "origem": "retro", "candidato": "renan-santos"}, {"data": "2019-05-14", "tipo": "video", "voz": "propria", "titulo": "A NOVA ERA NO STF | Por Rubinho Nunes", "fonte": "channel/UC8QAdpiEWAOg3AOCCFDCOYw", "url": "https://www.youtube.com/watch?v=8VKZyzNlQg8", "duracao_s": 284, "origem": "retro", "candidato": "renan-santos"}, {"data": "2019-05-09", "tipo": "video", "voz": "propria", "titulo": "A FARRA DO STF | Ulysses Moraes", "fonte": "channel/UC8QAdpiEWAOg3AOCCFDCOYw", "url": "https://www.youtube.com/watch?v=NB_jEZUrnwM", "duracao_s": 392, "origem": "retro", "candidato": "renan-santos"}, {"data": "2019-05-06", "tipo": "video", "voz": "propria", "titulo": "Documentário: Não Vai Ter Golpe - Quando estreia?", "fonte": "channel/UC8QAdpiEWAOg3AOCCFDCOYw", "url": "https://www.youtube.com/watch?v=WoRXNiHWFbg", "duracao_s": 1059, "origem": "retro", "candidato": "renan-santos"}, {"data": "2019-04-26", "tipo": "video", "voz": "propria", "titulo": "O GOLPE do Mourão | Por Renan Santos", "fonte": "channel/UC8QAdpiEWAOg3AOCCFDCOYw", "url": "https://www.youtube.com/watch?v=Ml-0YS26NVw", "duracao_s": 579, "origem": "retro", "candidato": "renan-santos"}, {"data": "2019-04-16", "tipo": "video", "voz": "propria", "titulo": "ENTENDA TUDO SOBRE A TRETA DO STF! | por Rubinho", "fonte": "channel/UC8QAdpiEWAOg3AOCCFDCOYw", "url": "https://www.youtube.com/watch?v=1hWLMyWYRyk", "duracao_s": 233, "origem": "retro", "candidato": "renan-santos"}, {"data": "2019-03-29", "tipo": "video", "voz": "propria", "titulo": "O STF feriu os direitos do animais? | Por Ricardo Almeida", "fonte": "channel/UC8QAdpiEWAOg3AOCCFDCOYw", "url": "https://www.youtube.com/watch?v=YopSG5lU0W4", "duracao_s": 578, "origem": "retro", "candidato": "renan-santos"}, {"data": "2019-02-28", "tipo": "video", "voz": "propria", "titulo": "BASTA! Impeachment de ministros do STF! | por Kim Kataguiri", "fonte": "channel/UC8QAdpiEWAOg3AOCCFDCOYw", "url": "https://www.youtube.com/watch?v=XrBiwURnFAM", "duracao_s": 549, "origem": "retro", "candidato": "renan-santos"}, {"data": "2019-02-20", "tipo": "video", "voz": "propria", "titulo": "Impeachment do Bolsonaro? É sério isso? | Por Rubinho Nunes", "fonte": "channel/UC8QAdpiEWAOg3AOCCFDCOYw", "url": "https://www.youtube.com/watch?v=Fyt5B_xIs10", "duracao_s": 474, "origem": "retro", "candidato": "renan-santos"}, {"data": "2019-02-13", "tipo": "video", "voz": "propria", "titulo": "STF foi pro PAU! Homofobia em pauta | por Rubens Nunes", "fonte": "channel/UC8QAdpiEWAOg3AOCCFDCOYw", "url": "https://www.youtube.com/watch?v=jC-8kyH4d3w", "duracao_s": 369, "origem": "retro", "candidato": "renan-santos"}]