[{"data": "2018-11-29", "tipo": "video", "voz": "propria", "titulo": "PRISÃO DO GOVERNADOR PEZÃO: DESDE 2016 DEFENDO SEU IMPEACHMENT !", "fonte": "channel/UCl2HptoHv6PjZMQAwTdA--Q", "url": "https://www.youtube.com/watch?v=O4giJw7GSO0", "duracao_s": 96, "origem": "retro", "candidato": "flavio-bolsonaro"}, {"data": "2018-11-08", "tipo": "video", "voz": "propria", "titulo": "BOLSONARO: AUMENTO DE SALÁRIO DO STF É TEMERÁRIO", "fonte": "channel/UCl2HptoHv6PjZMQAwTdA--Q", "url": "https://www.youtube.com/watch?v=9am6-yr4MG8", "duracao_s": 74, "origem": "retro", "candidato": "flavio-bolsonaro"}, {"data": "2018-10-23", "tipo": "video", "voz": "propria", "titulo": "BOLSONARO FALA SOBRE MANIFESTAÇÕES DE APOIO E COMENTÁRIO DE FILHO ENVOLVENDO O STF", "fonte": "channel/UCl2HptoHv6PjZMQAwTdA--Q", "url": "https://www.youtube.com/watch?v=7L_kvt-cbaA", "duracao_s": 327, "origem": "retro", "candidato": "flavio-bolsonaro"}, {"data": "2018-09-20", "tipo": "video", "voz": "propria", "titulo": "VOLTA DA CPMF E AUMENTO DE IMPOSTOS É MAIS UM FAKENEWS!", "fonte": "channel/UCl2HptoHv6PjZMQAwTdA--Q", "url": "https://www.youtube.com/watch?v=d1bzSwfiofs", "duracao_s": 57, "origem": "retro", "candidato": "flavio-bolsonaro"}, {"data": "2018-07-10", "tipo": "video", "voz": "propria", "titulo": "DERRUBAMOS O AUMENTO DO RIOPREVIDÊNCIA NO TJ/RJ", "fonte": "channel/UCl2HptoHv6PjZMQAwTdA--Q", "url": "https://www.youtube.com/watch?v=bjL2QJWeYbY", "duracao_s": 31, "origem": "retro", "candidato": "flavio-bolsonaro"}, {"data": "2018-07-09", "tipo": "video", "voz": "propria", "titulo": "Jair Bolsonaro fala do HC de Lula e sobre os ministros do STF com Marco Antonio Villa.", "fonte": "channel/UCl2HptoHv6PjZMQAwTdA--Q", "url": "https://www.youtube.com/watch?v=BKtwYcoJRNs", "duracao_s": 206, "origem": "retro", "candidato": "flavio-bolsonaro"}, {"data": "2018-07-05", "tipo": "video", "voz": "propria", "titulo": "BOLSONARO FOI O ÚNICO QUE SE MANIFESTOU SOBRE O IMPOSTO SINDICAL", "fonte": "channel/UCl2HptoHv6PjZMQAwTdA--Q", "url": "https://www.youtube.com/watch?v=DkNh7SL4Hro", "duracao_s": 65, "origem": "retro", "candidato": "flavio-bolsonaro"}, {"data": "2018-06-08", "tipo": "video", "voz": "propria", "titulo": "MAIS IMPOSTOS? TAXAR HERANÇA? RESPONDEMOS NA TV CORREIO!", "fonte": "channel/UCl2HptoHv6PjZMQAwTdA--Q", "url": "https://www.youtube.com/watch?v=7ppNUiPpQds", "duracao_s": 173, "origem": "retro", "candidato": "flavio-bolsonaro"}, {"data": "2018-05-29", "tipo": "video", "voz": "propria", "titulo": "BOLSONARO DEFENDE REDUÇÃO DE IMPOSTO PARA DIESEL DE CAMINHONEIROS.", "fonte": "channel/UCl2HptoHv6PjZMQAwTdA--Q", "url": "https://www.youtube.com/watch?v=lcOMxquGQfE", "duracao_s": 468, "origem": "retro", "candidato": "flavio-bolsonaro"}]