[{"data": "2020-09-09", "tipo": "video", "voz": "propria", "titulo": "Quem serão os novos ministros do STF?", "fonte": "channel/UC8QAdpiEWAOg3AOCCFDCOYw", "url": "https://www.youtube.com/watch?v=_X79qHppJw8", "duracao_s": 520, "origem": "retro", "candidato": "renan-santos"}, {"data": "2020-05-29", "tipo": "video", "voz": "propria", "titulo": "APOIAMOS INTERVENÇÃO NO STF", "fonte": "channel/UC8QAdpiEWAOg3AOCCFDCOYw", "url": "https://www.youtube.com/watch?v=GtAStn1n4ek", "duracao_s": 521, "origem": "retro", "candidato": "renan-santos"}, {"data": "2020-05-28", "tipo": "video", "voz": "propria", "titulo": "BOLSONARO QUER GOLPE!", "fonte": "channel/UC8QAdpiEWAOg3AOCCFDCOYw", "url": "https://www.youtube.com/watch?v=ycsLdpN-jyk", "duracao_s": 434, "origem": "retro", "candidato": "renan-santos"}, {"data": "2020-03-02", "tipo": "video", "voz": "propria", "titulo": "GOLPE NO ORÇAMENTO!!!", "fonte": "channel/UC8QAdpiEWAOg3AOCCFDCOYw", "url": "https://www.youtube.com/watch?v=cmTix_VoqwA", "duracao_s": 818, "origem": "retro", "candidato": "renan-santos"}, {"data": "2020-02-18", "tipo": "video", "voz": "propria", "titulo": "IMPEACHMENT DO BOLSONARO?", "fonte": "channel/UC8QAdpiEWAOg3AOCCFDCOYw", "url": "https://www.youtube.com/watch?v=8aI34_15h4U", "duracao_s": 514, "origem": "retro", "candidato": "renan-santos"}, {"data": "2020-02-06", "tipo": "video", "voz": "propria", "titulo": "O Impeachment de Trump #FicheiroMBL", "fonte": "channel/UC8QAdpiEWAOg3AOCCFDCOYw", "url": "https://www.youtube.com/watch?v=bFfvXjylfPs", "duracao_s": 458, "origem": "retro", "candidato": "renan-santos"}, {"data": "2020-01-29", "tipo": "video", "voz": "propria", "titulo": "DEPUTADO ULYSSES MORAES EXPÕE HIPOCRISIA DE PETISTAS NO MATO GROSSO", "fonte": "channel/UC8QAdpiEWAOg3AOCCFDCOYw", "url": "https://www.youtube.com/watch?v=L011d4bBAi8", "duracao_s": 153, "origem": "retro", "candidato": "renan-santos"}, {"data": "2020-01-28", "tipo": "video", "voz": "propria", "titulo": "Moro 2022? Mudança no STF? Kim Comenta", "fonte": "channel/UC8QAdpiEWAOg3AOCCFDCOYw", "url": "https://www.youtube.com/watch?v=bUoj1nGDzfY", "duracao_s": 523, "origem": "retro", "candidato": "renan-santos"}]